{"artifact_index":{"path":"docs/saq_a4_v2_par_artifacts_2026_07_14/artifact_index.json","sha256":"ffffffffffffffffffffffffffffffffffffffffffffffffffffffffffffffff","size_bytes":18446744073709551615},"artifact_kind":"a4_v2_par_seal","build_manifest":{"path":"docs/saq_a4_v2_par_artifacts_2026_07_14/build_manifest.json","sha256":"ffffffffffffffffffffffffffffffffffffffffffffffffffffffffffffffff","size_bytes":18446744073709551615},"implementation_commit":"ffffffffffffffffffffffffffffffffffffffff","parity_pass":true,"parity_summary":{"path":"docs/saq_a4_v2_par_artifacts_2026_07_14/parity_summary.json","sha256":"ffffffffffffffffffffffffffffffffffffffffffffffffffffffffffffffff","size_bytes":18446744073709551615},"phase_byte_ledger":[{"created_temporary_bytes":18446744073709551615,"deleted_partial_bytes":18446744073709551615,"maximum_live_owned_temporary_bytes":18446744073709551615,"permanent_intermediate_bundle_bytes":18446744073709551615,"phase":"B_build","research_evidence_archive_bytes":18446744073709551615},{"created_temporary_bytes":18446744073709551615,"deleted_partial_bytes":18446744073709551615,"maximum_live_owned_temporary_bytes":18446744073709551615,"permanent_intermediate_bundle_bytes":18446744073709551615,"phase":"P_parity","research_evidence_archive_bytes":18446744073709551615}],"phase_receipts":[{"argv_sha256":"ffffffffffffffffffffffffffffffffffffffffffffffffffffffffffffffff","attempt_id":0,"binary_sha256":"ffffffffffffffffffffffffffffffffffffffffffffffffffffffffffffffff","completed_unit_index":-1,"cpu_microseconds":86400000000,"end_utc":"9999-12-31T23:59:59.999999Z","environment_sha256":"ffffffffffffffffffffffffffffffffffffffffffffffffffffffffffffffff","execution_commit":"ffffffffffffffffffffffffffffffffffffffff","exit_reason":"EXTERNAL_SIGNAL_64","logical_run_id":"ffffffffffffffffffffffffffffffffffffffffffffffffffffffffffffffff","peak_rss_bytes":18446744073709551615,"phase":"B_build","staging_disposition":"DISCARDED","start_utc":"9999-12-31T23:59:59.999999Z","wall_nanoseconds":172800000000000},{"argv_sha256":"ffffffffffffffffffffffffffffffffffffffffffffffffffffffffffffffff","attempt_id":1,"binary_sha256":"ffffffffffffffffffffffffffffffffffffffffffffffffffffffffffffffff","completed_unit_index":-1,"cpu_microseconds":86400000000,"end_utc":"9999-12-31T23:59:59.999999Z","environment_sha256":"ffffffffffffffffffffffffffffffffffffffffffffffffffffffffffffffff","execution_commit":"ffffffffffffffffffffffffffffffffffffffff","exit_reason":"PHASE_COMPLETE","logical_run_id":"ffffffffffffffffffffffffffffffffffffffffffffffffffffffffffffffff","peak_rss_bytes":18446744073709551615,"phase":"B_build","staging_disposition":"NONE","start_utc":"9999-12-31T23:59:59.999999Z","wall_nanoseconds":172800000000000},{"argv_sha256":"ffffffffffffffffffffffffffffffffffffffffffffffffffffffffffffffff","attempt_id":0,"binary_sha256":"ffffffffffffffffffffffffffffffffffffffffffffffffffffffffffffffff","completed_unit_index":-1,"cpu_microseconds":86400000000,"end_utc":"9999-12-31T23:59:59.999999Z","environment_sha256":"ffffffffffffffffffffffffffffffffffffffffffffffffffffffffffffffff","execution_commit":"ffffffffffffffffffffffffffffffffffffffff","exit_reason":"EXTERNAL_SIGNAL_64","logical_run_id":"ffffffffffffffffffffffffffffffffffffffffffffffffffffffffffffffff","peak_rss_bytes":18446744073709551615,"phase":"P_parity","staging_disposition":"DISCARDED","start_utc":"9999-12-31T23:59:59.999999Z","wall_nanoseconds":172800000000000},{"argv_sha256":"ffffffffffffffffffffffffffffffffffffffffffffffffffffffffffffffff","attempt_id":1,"binary_sha256":"ffffffffffffffffffffffffffffffffffffffffffffffffffffffffffffffff","completed_unit_index":-1,"cpu_microseconds":86400000000,"end_utc":"9999-12-31T23:59:59.999999Z","environment_sha256":"ffffffffffffffffffffffffffffffffffffffffffffffffffffffffffffffff","execution_commit":"ffffffffffffffffffffffffffffffffffffffff","exit_reason":"PHASE_COMPLETE","logical_run_id":"ffffffffffffffffffffffffffffffffffffffffffffffffffffffffffffffff","peak_rss_bytes":18446744073709551615,"phase":"P_parity","staging_disposition":"NONE","start_utc":"9999-12-31T23:59:59.999999Z","wall_nanoseconds":172800000000000}],"producer_native":{"path":"build/a4_v2/a4_v2_native","sha256":"ffffffffffffffffffffffffffffffffffffffffffffffffffffffffffffffff","size_bytes":18446744073709551615},"protocol":{"path":"docs/saq_a4_v2_protocol_authority_manifest_2026_07_14.json","sha256":"ffffffffffffffffffffffffffffffffffffffffffffffffffffffffffffffff","size_bytes":18446744073709551615},"schema":{"path":"docs/saq_a4_v2_artifact_schema_2026_07_14.json","sha256":"ffffffffffffffffffffffffffffffffffffffffffffffffffffffffffffffff","size_bytes":18446744073709551615},"schema_version":1,"source_manifest":{"path":"docs/saq_a4_v2_implementation_manifest_2026_07_14.json","sha256":"ffffffffffffffffffffffffffffffffffffffffffffffffffffffffffffffff","size_bytes":18446744073709551615},"source_tree_sha256":"ffffffffffffffffffffffffffffffffffffffffffffffffffffffffffffffff","verifier_native":{"path":"build/a4_v2_verifier/a4_v2_native","sha256":"ffffffffffffffffffffffffffffffffffffffffffffffffffffffffffffffff","size_bytes":18446744073709551615}}
